company_name,company_label,address,address_2,postcode,city,sic_4,sic_2,sic_industry_german,sic_industry_english,solon_av_industry,employees,employees_bracket,lat,lon,country
Pflüger Rechtsanwälte,Pflüger Rechtsanwälte,Kaiserstr. 44,,60329,Frankfurt am Main,8111,81,Juristische Dienstleistungen,Legal Services,Services,13,Small 10 - 49,50.1089527,8.6698335,Germany
PH Baugesellschaft mbH,PH Baugesellschaft mbH,Bleichstr. 2-4,,60313,Frankfurt am Main,5082,50,Bau- u. Bergbaumaschinen u. Ausrüstung,Wholesale Trade - Durable Goods,Wholesale & retail trade,23,Small 10 - 49,50.11804,8.68803,Germany
Pharm-Allergan GmbH,Pharm-Allergan GmbH,Westhafenplatz 6-8,,60327,Frankfurt am Main,2834,28,Pharmazeutische Präparate,Chemicals and Allied Products,Manufacturing,200,Medium 50 - 249,50.1007106,8.6641758,Germany
PHD Germany GmbH,PHD Germany GmbH,Hanauer Landstr. 182a,,60314,Frankfurt am Main,7311,73,Werbeagenturen,Business Services,Services,70,Medium 50 - 249,50.1145271,8.7216275,Germany
Phersu Consult GmbH,Phersu Consult GmbH,Kaiserhofstr. 10,,60313,Frankfurt am Main,7361,73,"Arbeitsämter, Arbeitsbeschaffungsstellen",Business Services,Services,40,Small 10 - 49,50.1151417,8.6749854,Germany
PHILIPP DRESTE Bauunternehmung GmbH,PHILIPP DRESTE Bauunternehmung,Friedrich-Kahl-Str. 7,,60489,Frankfurt am Main,1611,16,"Autobahn- u. Straßenbau, außer Straßenhochbauten","Heavy Cnstrctn, Except Building Construction - Contractors",Construction,35,Small 10 - 49,50.1324296,8.5916352,Germany
Phillip Degenhart,Phillip Degenhart,Berliner Str. 72,,60311,Frankfurt am Main,5812,58,"Restaurants, Schnellimbiß usw.",Eating and Drinking Places,Services,11,Small 10 - 49,50.11098,8.67799,Germany
Philosophisch-Theologische Hochschule Sankt Georgen e.V.,Philosophisch-Theologische,Offenbacher Landstr. 224,,60599,Frankfurt am Main,8221,82,Universitäten u. Hochschulen,Educational Services,Services,30,Small 10 - 49,50.0991294,8.7134007,Germany
Phoenix Real Estate Development GmbH,Phoenix Real Estate,Guiollettstr. 48,,60325,Frankfurt am Main,8742,87,Unternehmensberatung,"Engineering, Accounting, Research, Management & Related Svcs",Services,12,Small 10 - 49,50.11473,8.66431,Germany
Phönix-Apotheke Michael Baum,Phönix-Apotheke Michael Baum,Mainzer Landstr. 800,,65934,Frankfurt am Main,5912,59,"Drogerien, Apotheken",Miscellaneous Retail,Wholesale & retail trade,15,Small 10 - 49,50.0985655,8.5670518,Germany
Phorms Hessen gemeinnützige GmbH,Phorms Hessen gemeinnützige,Fürstenbergerstr. 3-9,,60322,Frankfurt am Main,8211,82,"Internate, Kindergärten, Grund- u. Hauptschulen, höhere Schulen",Educational Services,Services,74,Medium 50 - 249,50.1258427,8.6812189,Germany
Piepenbrock GmbH,Piepenbrock GmbH,Ludwig-Landmann-Str. 349,,60487,Frankfurt am Main,7349,73,"Sonstige Hausreinigungs- u. Instandhaltungsdienste, Gebäudereinigung",Business Services,Services,632,Large 250 +,50.12731,8.62231,Germany
Pilot Training Network GmbH,Pilot Training Network GmbH,Airportring,,60549,Frankfurt am Main,8249,82,Berufsschulen außer Fachoberschulen,Educational Services,Services,53,Medium 50 - 249,50.0422863,8.5368499,Germany
Pinar Foods GmbH,Pinar Foods GmbH,Mainzer Landstr. 69-71,,60329,Frankfurt am Main,2099,20,Sonstige Lebensmittelprodukte,Food and Kindred Products,Manufacturing,10,Small 10 - 49,50.1101932,8.6628218,Germany
PINK CARROTS GmbH,PINK CARROTS GmbH,Solmsstr. 4,,60486,Frankfurt am Main,7311,73,Werbeagenturen,Business Services,Services,44,Small 10 - 49,50.11897,8.63742,Germany
Pixelgenau Consulting GmbH,Pixelgenau Consulting GmbH,Hanauer Landstr. 151-153,,60314,Frankfurt am Main,7371,73,Programmierungsdienste für Computer etc.,Business Services,Services,15,Small 10 - 49,50.11307,8.71527,Germany
PIXOMONDO STUDIOS GmbH & Co. KG,PIXOMONDO STUDIOS GmbH & Co.,Lindleystr. 12,,60314,Frankfurt am Main,7812,78,Film- und Video-Produktion,Motion Pictures,Services,80,Medium 50 - 249,50.1124032,8.7192312,Germany
Pizzeria Ristorante La Divina,Pizzeria Ristorante La Divina,Feldbergstr. 30,,60323,Frankfurt am Main,5812,58,"Restaurants, Schnellimbiß usw.",Eating and Drinking Places,Services,13,Small 10 - 49,50.1221981,8.6615448,Germany
PK Das Personal-Kontor GmbH,PK Das Personal-Kontor GmbH,Niddastr. 98-102,,60329,Frankfurt am Main,7363,73,Vermittlungsbüros für Aushilfskräfte,Business Services,Services,20,Small 10 - 49,50.1074779,8.6579488,Germany
PKF FASSELT SCHLAGE Services GmbH Wirtschaftsprüfungsgesellschaft Steuerberatungsgesellschaft,PKF FASSELT SCHLAGE Services,Ulmenstr. 37-39,,60325,Frankfurt am Main,8721,87,"Buchhaltungs-, Wirtschafts- u. Steuerprüfungsbüros","Engineering, Accounting, Research, Management & Related Svcs",Services,69,Medium 50 - 249,50.1157212,8.6653805,Germany
plan - j gmbh,plan - j gmbh,Kleyerstr. 46-48,,60326,Frankfurt am Main,8712,87,Architektendienste,"Engineering, Accounting, Research, Management & Related Svcs",Services,10,Small 10 - 49,50.100814,8.6384021,Germany
Planet Retail GmbH,Planet Retail GmbH,Weserstr. 4,,60329,Frankfurt am Main,8732,87,"Gewerbliche ökonomische, soziologische und pädagogische Forschungseinr.","Engineering, Accounting, Research, Management & Related Svcs",Services,16,Small 10 - 49,50.1076257,8.6708509,Germany
Planon GmbH,Planon GmbH,Wilhelm-Leuschner-Str. 79,,60329,Frankfurt am Main,5045,50,"Computer, Computerzubehör u. Software",Wholesale Trade - Durable Goods,Wholesale & retail trade,14,Small 10 - 49,50.103556,8.6663616,Germany
Planquadrat 4 GmbH,Planquadrat 4 GmbH,Hanauer Landstr. 52,,60314,Frankfurt am Main,8711,87,Technische Dienste,"Engineering, Accounting, Research, Management & Related Svcs",Services,20,Small 10 - 49,50.11263,8.7016514,Germany
Planungsverband Ballungsraum Frankfurt/ Rhein-Main,Planungsverband Ballungsraum,Poststr. 16,,60329,Frankfurt am Main,8748,87,Sonstige Beratungsdienste,"Engineering, Accounting, Research, Management & Related Svcs",Services,140,Medium 50 - 249,50.1074247,8.6605466,Germany
PlasticsEurope Deutschland e.V.,PlasticsEurope Deutschland,Mainzer Landstr. 55,,60329,Frankfurt am Main,8621,86,Berufsverbände,Membership Organizations,Services,15,Small 10 - 49,50.1103456,8.6632646,Germany
PLATOW Medien GmbH,PLATOW Medien GmbH,Stuttgarter Str. 25-29,,60329,Frankfurt am Main,6719,67,Sonstige Holding-Gesellschaften,Holding and Other Investment Offices,"Finance, Insurance, and Real Estate",13,Small 10 - 49,50.1036759,8.6624419,Germany
Plaubel GmbH,Plaubel GmbH,Carl-Zeiss-Str. 5,,60388,Frankfurt am Main,3861,38,"Fotografische Ausrüstung, Microfilm, Fotokopiermaschinen",Mesr/Anlyz/Cntrl Instrmnts; Photo/Med/Opt Gds; Watchs/Clocks,Manufacturing,14,Small 10 - 49,50.14184,8.74593,Germany
plenum AG,plenum AG,Am Flughafen,,60549,Frankfurt am Main,6719,67,Sonstige Holding-Gesellschaften,Holding and Other Investment Offices,"Finance, Insurance, and Real Estate",390,Large 250 +,50.0379326,8.5621518,Germany
Plug and work Airport GmbH,Plug and work Airport GmbH,Mainzer Landstr. 49,,60329,Frankfurt am Main,6531,65,"Immobilien-Agenten, Makler u. Verwalter",Real Estate,"Finance, Insurance, and Real Estate",16,Small 10 - 49,50.110591,8.6641766,Germany
Plus.line AG,Plus.line AG,Mainzer Landstr. 199,,60326,Frankfurt am Main,4813,48,Telekommunikation (außer drahtlos),Communications,Transportation and Public Utilities,50,Small 10 - 49,50.1045924,8.6492593,Germany
PlusAlpina Real Estate Management GmbH,PlusAlpina Real Estate,Schaumainkai 69,,60596,Frankfurt am Main,6531,65,"Immobilien-Agenten, Makler u. Verwalter",Real Estate,"Finance, Insurance, and Real Estate",15,Small 10 - 49,50.1027599,8.6723335,Germany
PM & Partner MARKETING CONSULTING GmbH,PM & Partner MARKETING,Lyoner Str. 34,,60528,Frankfurt am Main,8742,87,Unternehmensberatung,"Engineering, Accounting, Research, Management & Related Svcs",Services,16,Small 10 - 49,50.07833,8.62353,Germany
PME Familienservice gGmbH,PME Familienservice gGmbH,Guiollettstr. 18-22,,60325,Frankfurt am Main,8351,83,Kindertagesstätten,Social Services,Services,451,Large 250 +,50.11454,8.6676,Germany
PMS Optik AG,PMS Optik AG,Kölner Str. 42,,60327,Frankfurt am Main,3827,38,Optische Instrumente u. Linsen,Mesr/Anlyz/Cntrl Instrmnts; Photo/Med/Opt Gds; Watchs/Clocks,Manufacturing,10,Small 10 - 49,50.1075194,8.6483084,Germany
PNEUMO Drucklufttechnik GmbH,PNEUMO Drucklufttechnik GmbH,Sontraer Str. 11,,60386,Frankfurt am Main,5084,50,"Industriemaschinen u. Ausrüstung, Pumpen, Gabelstapler, Farbspritzanlagen",Wholesale Trade - Durable Goods,Wholesale & retail trade,14,Small 10 - 49,50.1299953,8.743906,Germany
PNO Di Gennaro Kfz.-Werkstätten GmbH,PNO Di Gennaro,Voltenseestr. 4,,60388,Frankfurt am Main,7539,75,Sonstige KFZ-Reparaturwerkstätten,"Automotive Repair, Services and Parking",Services,36,Small 10 - 49,50.1455147,8.7458038,Germany
Pohlschroeder Lewis Larcher GmbH & Co. KG,Pohlschroeder Lewis Larcher,Am Salzhaus 6,,60311,Frankfurt am Main,8742,87,Unternehmensberatung,"Engineering, Accounting, Research, Management & Related Svcs",Services,10,Small 10 - 49,50.111965,8.677397,Germany
POLARES Real Estate Asset Management GmbH,POLARES Real Estate Asset,Messeturm,,60308,Frankfurt am Main,6531,65,"Immobilien-Agenten, Makler u. Verwalter",Real Estate,"Finance, Insurance, and Real Estate",80,Medium 50 - 249,50.1123829,8.6527429,Germany
POLYTRADE GMBH,POLYTRADE GMBH,Borsigallee 12,,60388,Frankfurt am Main,5169,51,Sonstige Chemikalien u. verw. Produkte,Wholesale Trade - Nondurable Goods,Wholesale & retail trade,12,Small 10 - 49,50.13454,8.74229,Germany
ponturo consulting AG,ponturo consulting AG,Wilhelm-Leuschner-Str. 81,,60329,Frankfurt am Main,8748,87,Sonstige Beratungsdienste,"Engineering, Accounting, Research, Management & Related Svcs",Services,16,Small 10 - 49,50.1034206,8.66598,Germany
portfolio Verlagsgesellschaft mbH,portfolio Verlagsgesellschaft,Kleine Hochstr. 9-11,,60313,Frankfurt am Main,2721,27,"Zeitschriften: Verlag, Druckerei u. Verlag","Printing, Publishing and Allied Industries",Manufacturing,25,Small 10 - 49,50.1153195,8.6740509,Germany
POS support GmbH,POS support GmbH,Westerbachstr. 47,,60489,Frankfurt am Main,7311,73,Werbeagenturen,Business Services,Services,12,Small 10 - 49,50.1222598,8.6007543,Germany
Poseidon Marktforschungs- und Servicegesellschaft mbH,Poseidon Marktforschungs- und,Olof-Palme-Str. 15,,60439,Frankfurt am Main,8732,87,"Gewerbliche ökonomische, soziologische und pädagogische Forschungseinr.","Engineering, Accounting, Research, Management & Related Svcs",Services,100,Medium 50 - 249,50.1675134,8.6444849,Germany
Power Plate GmbH,Power Plate GmbH,Berner Str. 43,,60437,Frankfurt am Main,5091,50,Sport- u. Freizeitartikel,Wholesale Trade - Durable Goods,Wholesale & retail trade,44,Small 10 - 49,50.19347,8.66192,Germany
Powerland AG,Powerland AG,Fellnerstr. 7-9,,60322,Frankfurt am Main,6719,67,Sonstige Holding-Gesellschaften,Holding and Other Investment Offices,"Finance, Insurance, and Real Estate",1700,Large 250 +,50.1185767,8.6771181,Germany
PP Agentur für Events & Promotions GmbH,PP Agentur für Events &,Walther-von-Cronberg-Platz 6,,60594,Frankfurt am Main,7311,73,Werbeagenturen,Business Services,Services,25,Small 10 - 49,50.10594,8.69645,Germany
PP:AGENDA GmbH,PP:AGENDA GmbH,Hanauer Landstr. 135,,60314,Frankfurt am Main,8748,87,Sonstige Beratungsdienste,"Engineering, Accounting, Research, Management & Related Svcs",Services,10,Small 10 - 49,50.11237,8.71356,Germany
Praunheimer Werkstätten Gemeinnützige GmbH,Praunheimer Werkstätten,Krautgartenweg 1,,60439,Frankfurt am Main,8331,83,Berufstraining u. berufliche Wiedereingliederung,Social Services,Services,1333,Large 250 +,50.16919,8.62206,Germany
Praxis für Kinderzahnheilkunde Dr. Catharina Steuer,Praxis für Kinderzahnheilkunde,Barckhausstr. 1,,60325,Frankfurt am Main,8021,80,Zahnärzte,Health Services,Services,10,Small 10 - 49,50.11587,8.66413,Germany
Praxis für Physiotherapie & Medical Wellness,Praxis für Physiotherapie &,Marburger Str. 28,,60487,Frankfurt am Main,8049,80,Sonstige Heilpraktiker,Health Services,Services,11,Small 10 - 49,50.1246673,8.6440966,Germany
Präzisionsdreherei Johann Kölbel Nachfolger GmbH,Präzisionsdreherei Johann,Hausener Weg 29,,60489,Frankfurt am Main,3471,34,"Galvanisieren, Verchromen, Polieren, Eloxieren, Kolorieren von Metall","Fabricated Metal Prdcts, Except Machinery & Transport Eqpmnt",Manufacturing,13,Small 10 - 49,50.13081,8.6175,Germany
Prematechnik GmbH,Prematechnik GmbH,Bleichstr. 64-66,,60313,Frankfurt am Main,2899,28,"Sonstige Chemikalien u. chemische Präparate, Salz, Essenzen, Feuerwerk",Chemicals and Allied Products,Manufacturing,11,Small 10 - 49,50.1174061,8.6808619,Germany
Premiere Conferencing GmbH,Premiere Conferencing GmbH,Hanauer Landstr. 182a,,60314,Frankfurt am Main,7389,73,Sonstige gewerbliche Dienstleistungen,Business Services,Services,32,Small 10 - 49,50.1145271,8.7216275,Germany
PremiumCircle Deutschland GmbH,PremiumCircle Deutschland GmbH,Herriotstr. 1,,60528,Frankfurt am Main,8299,82,Sonstige Schulen u. Ausbildungsstätten,Educational Services,Services,31,Small 10 - 49,50.0810641,8.629639,Germany
Presse Verlagsgesellschaft für Zeitschriften und neue Medien mbH,Presse Verlagsgesellschaft für,Ludwigstr. 33-37,,60327,Frankfurt am Main,2721,27,"Zeitschriften: Verlag, Druckerei u. Verlag","Printing, Publishing and Allied Industries",Manufacturing,40,Small 10 - 49,50.1089963,8.6571846,Germany
PricewaterhouseCoopers,PricewaterhouseCoopers,Friedrich-Ebert-Anlage 35-37,,60327,Frankfurt am Main,8721,87,"Buchhaltungs-, Wirtschafts- u. Steuerprüfungsbüros","Engineering, Accounting, Research, Management & Related Svcs",Services,2015,Large 250 +,50.1110822,8.6559151,Germany
Prime Capital AG,Prime Capital AG,Bockenheimer Landstr. 51-53,,60325,Frankfurt am Main,7389,73,Sonstige gewerbliche Dienstleistungen,Business Services,Services,35,Small 10 - 49,50.1170896,8.6643578,Germany
PRISM INTERNATIONAL GmbH,PRISM INTERNATIONAL GmbH,Darmstädter Landstr. 112,,60598,Frankfurt am Main,8743,87,Public relations Dienste,"Engineering, Accounting, Research, Management & Related Svcs",Services,22,Small 10 - 49,50.095573,8.690631,Germany
"Private Zahnheilkunde Dr. Heimann, Dr. Winzen, Dr. Alp",Private Zahnheilkunde Dr.,Pfannmüllerstr. 48,,60488,Frankfurt am Main,8021,80,Zahnärzte,Health Services,Services,11,Small 10 - 49,50.1300965,8.6240671,Germany
Private-Kant-Schule,Private-Kant-Schule,Hammanstr. 9,,60322,Frankfurt am Main,8211,82,"Internate, Kindergärten, Grund- u. Hauptschulen, höhere Schulen",Educational Services,Services,15,Small 10 - 49,50.1248,8.67668,Germany
PRIWO OHG für Vertrieb und Mieterprivatisierung,PRIWO OHG für Vertrieb und,Glauburgstr. 95,,60318,Frankfurt am Main,6531,65,"Immobilien-Agenten, Makler u. Verwalter",Real Estate,"Finance, Insurance, and Real Estate",12,Small 10 - 49,50.1259007,8.6824064,Germany
PRM Mail Service Rhein - Main e.Kfm.,PRM Mail Service Rhein - Main,Bruchstr. 17,,60594,Frankfurt am Main,7361,73,"Arbeitsämter, Arbeitsbeschaffungsstellen",Business Services,Services,25,Small 10 - 49,50.1024,8.68763,Germany
"pro familia Deutsche Gesellschaft für Familienplanung, Sexualpädagogik und Sexualberatung e.V. Bundesverband",pro familia Deutsche,Stresemannallee 3,,60596,Frankfurt am Main,8322,83,Soziale Einrichtungen f. Alleinstehende u. Familien,Social Services,Services,12,Small 10 - 49,50.09959,8.6689,Germany
PRO REHA Therapiezentrum GmbH,PRO REHA Therapiezentrum GmbH,Scheffelstr. 14,,60318,Frankfurt am Main,8093,80,Sonstige ambulante ärztliche Versorgung,Health Services,Services,18,Small 10 - 49,50.1211332,8.6885142,Germany
PROCOIN GmbH,PROCOIN GmbH,Silostr. 31/3-3a,,65929,Frankfurt am Main,5084,50,"Industriemaschinen u. Ausrüstung, Pumpen, Gabelstapler, Farbspritzanlagen",Wholesale Trade - Durable Goods,Wholesale & retail trade,30,Small 10 - 49,50.1006151,8.5280154,Germany
ProCredit AG,ProCredit AG,Rohmerplatz 33-37,,60486,Frankfurt am Main,6163,61,Anleihe-Vermittler,Nondepository Credit Institutions,"Finance, Insurance, and Real Estate",229,Medium 50 - 249,50.1212078,8.6448041,Germany
proCum Cert GmbH Zertifizierungsgesellschaft,proCum Cert GmbH,Düsseldorfer Str. 9,,60329,Frankfurt am Main,8711,87,Technische Dienste,"Engineering, Accounting, Research, Management & Related Svcs",Services,12,Small 10 - 49,50.1087577,8.6615009,Germany
Pro-Duo Deutschland GmbH,Pro-Duo Deutschland GmbH,Moselstr. 27,,60329,Frankfurt am Main,5122,51,"Apothekerware, Pharmazeutika, Drogen, Drogeriewaren, Kosmetikartikel",Wholesale Trade - Nondurable Goods,Wholesale & retail trade,200,Medium 50 - 249,50.1077194,8.6667784,Germany
Prof. Dr. Christoph Philipp Schließmann,Prof. Dr. Christoph Philipp,Hansaallee 22,,60322,Frankfurt am Main,8111,81,Juristische Dienstleistungen,Legal Services,Services,82,Medium 50 - 249,50.1249854,8.673549,Germany
Prof. Dr. Hermann Plagemann,Prof. Dr. Hermann Plagemann,Myliusstr. 15,,60323,Frankfurt am Main,8111,81,Juristische Dienstleistungen,Legal Services,Services,23,Small 10 - 49,50.1192101,8.6618267,Germany
"Prof. Dr. K. Schwantag Dr. P. Kraushaar GmbH, Wirtschaftsprüfungsgesellschaft",Prof. Dr. K. Schwantag Dr. P.,Zeilweg 42,,60439,Frankfurt am Main,8721,87,"Buchhaltungs-, Wirtschafts- u. Steuerprüfungsbüros","Engineering, Accounting, Research, Management & Related Svcs",Services,18,Small 10 - 49,50.16467,8.64336,Germany
Professionals on Demand GmbH,Professionals on Demand GmbH,Lyoner Str. 34,,60528,Frankfurt am Main,8748,87,Sonstige Beratungsdienste,"Engineering, Accounting, Research, Management & Related Svcs",Services,33,Small 10 - 49,50.07833,8.62353,Germany
Profis Dienstleistungen GmbH,Profis Dienstleistungen GmbH,Kasinostr. 31,,65929,Frankfurt am Main,1531,15,Bauträgergesellschaft f. eigene Rechnung zum späteren Verkauf von Objekten,Building Cnstrctn - General Contractors & Operative Builders,Construction,30,Small 10 - 49,50.1026129,8.548469,Germany
Projekt AG Planungsgesellschaft für Gebäudetechnik,Projekt AG,Bettinastr. 62,,60325,Frankfurt am Main,8711,87,Technische Dienste,"Engineering, Accounting, Research, Management & Related Svcs",Services,15,Small 10 - 49,50.1136319,8.658507,Germany
Projektgesellschaft Mainzer Landstraße 47 mbH & Co. KG,Projektgesellschaft Mainzer,Hochstr. 33,,60313,Frankfurt am Main,6531,65,"Immobilien-Agenten, Makler u. Verwalter",Real Estate,"Finance, Insurance, and Real Estate",10,Small 10 - 49,50.1159416,8.6754823,Germany
Prolytic GmbH,Prolytic GmbH,Alt Fechenheim 34,,60386,Frankfurt am Main,8071,80,Medizinische Laboratorien,Health Services,Services,13,Small 10 - 49,50.12858,8.7672,Germany
PROMERIT AG,PROMERIT AG,Speicherstr. 57-59,,60327,Frankfurt am Main,8748,87,Sonstige Beratungsdienste,"Engineering, Accounting, Research, Management & Related Svcs",Services,52,Medium 50 - 249,50.0985223,8.656278,Germany
PROPROJEKT Planungsmanagement & Projektberatung GmbH,PROPROJEKT Planungsmanagement,Hedderichstr. 108-110,,60596,Frankfurt am Main,8711,87,Technische Dienste,"Engineering, Accounting, Research, Management & Related Svcs",Services,20,Small 10 - 49,50.0982839,8.6819118,Germany
proseed GmbH,proseed GmbH,Fahrgasse 89,,60311,Frankfurt am Main,7311,73,Werbeagenturen,Business Services,Services,15,Small 10 - 49,50.1129392,8.6860523,Germany
PROTEMP Gesellschaft für industrielle Temperaturmessung mbH,PROTEMP Gesellschaft für,Westenbergerstr. 30,,65931,Frankfurt am Main,3829,38,Sonstige Meß- u. Regelgeräte,Mesr/Anlyz/Cntrl Instrmnts; Photo/Med/Opt Gds; Watchs/Clocks,Manufacturing,11,Small 10 - 49,50.0799453,8.5134475,Germany
Proteome Sciences R&D GmbH & Co. KG,Proteome Sciences R&D GmbH &,Altenhöferallee 3,,60438,Frankfurt am Main,8731,87,Gewerbliche physikalische u. biologische Forschungseinrichtungen,"Engineering, Accounting, Research, Management & Related Svcs",Services,23,Small 10 - 49,50.1747589,8.6315359,Germany
Protiviti GmbH,Protiviti GmbH,Taunusanlage 17,,60325,Frankfurt am Main,8748,87,Sonstige Beratungsdienste,"Engineering, Accounting, Research, Management & Related Svcs",Services,55,Medium 50 - 249,50.11463,8.66857,Germany
Provadis School of International Management and Technology AG,Provadis School of,Industriepark Höchst,,65926,Frankfurt am Main,8221,82,Universitäten u. Hochschulen,Educational Services,Services,25,Small 10 - 49,50.0890617,8.5375786,Germany
Proventa AG,Proventa AG,Untermainkai 29,,60329,Frankfurt am Main,7379,73,Sonstige Dienstleistungen auf dem Computersektor,Business Services,Services,85,Medium 50 - 249,50.10539,8.67122,Germany
PRO-VOGUE Marketing GmbH,PRO-VOGUE Marketing GmbH,Bremer Str. 6,,60323,Frankfurt am Main,7311,73,Werbeagenturen,Business Services,Services,12,Small 10 - 49,50.12585,8.67117,Germany
Prüfungs- und Treuhand GmbH Wirtschaftsprüfungsgesellschaft Steuerberatungsgesellschaft,Prüfungs- und Treuhand GmbH,Insterburger Str. 16,,60487,Frankfurt am Main,8721,87,"Buchhaltungs-, Wirtschafts- u. Steuerprüfungsbüros","Engineering, Accounting, Research, Management & Related Svcs",Services,20,Small 10 - 49,50.126984,8.6244829,Germany
PSD Group GmbH,PSD Group GmbH,Roßmarkt 10,,60311,Frankfurt am Main,8748,87,Sonstige Beratungsdienste,"Engineering, Accounting, Research, Management & Related Svcs",Services,30,Small 10 - 49,50.1128572,8.6777171,Germany
PSM&W GmbH,PSM&W GmbH,Clemensstr. 10,,60487,Frankfurt am Main,8743,87,Public relations Dienste,"Engineering, Accounting, Research, Management & Related Svcs",Services,37,Small 10 - 49,50.1213171,8.6496239,Germany
PUBLIC NEWS Gesellschaft für Werbung und Marketing mbH,PUBLIC NEWS Gesellschaft für,Rennbahnstr. 72-74,,60528,Frankfurt am Main,7374,73,Datenverarbeitungsdienste,Business Services,Services,100,Medium 50 - 249,50.0835846,8.6506426,Germany
PubliCare Marketing Communications GmbH,PubliCare Marketing,Städelstr. 10,,60596,Frankfurt am Main,7311,73,Werbeagenturen,Business Services,Services,14,Small 10 - 49,50.1044144,8.6774214,Germany
Pump GmbH Elektrotechnik - Elektronik,Pump GmbH Elektrotechnik -,Silostr. 33,,65929,Frankfurt am Main,5084,50,"Industriemaschinen u. Ausrüstung, Pumpen, Gabelstapler, Farbspritzanlagen",Wholesale Trade - Durable Goods,Wholesale & retail trade,10,Small 10 - 49,50.10017,8.52748,Germany
Putzmunter GmbH,Putzmunter GmbH,Emser Str. 33,,60486,Frankfurt am Main,7349,73,"Sonstige Hausreinigungs- u. Instandhaltungsdienste, Gebäudereinigung",Business Services,Services,92,Medium 50 - 249,50.1159084,8.6437974,Germany
PVG Presse-Vertriebs-Gesellschaft KG,PVG,Am Martinszehnten 13,,60437,Frankfurt am Main,5192,51,"Bücher, Zeitschriften, Zeitungen",Wholesale Trade - Nondurable Goods,Wholesale & retail trade,450,Large 250 +,50.19073,8.65424,Germany
PVW GmbH Wirtschaftsprüfungsgesellschaft Steuerberatungsgesellschaft,PVW GmbH,Mainzer Landstr. 46,,60325,Frankfurt am Main,8721,87,"Buchhaltungs-, Wirtschafts- u. Steuerprüfungsbüros","Engineering, Accounting, Research, Management & Related Svcs",Services,31,Small 10 - 49,50.1113195,8.6646865,Germany
PZ AKUSTIKDECKEN GmbH,PZ AKUSTIKDECKEN GmbH,Seehofstr. 46,,60594,Frankfurt am Main,1742,17,"Stuckarbeiten, akustische u. andere Isolierarbeiten",Construction - Special Trade Contractors,Construction,10,Small 10 - 49,50.1040106,8.6962173,Germany
QAD Europe GmbH,QAD Europe GmbH,Walther-von-Cronberg-Platz 13,,60594,Frankfurt am Main,5045,50,"Computer, Computerzubehör u. Software",Wholesale Trade - Durable Goods,Wholesale & retail trade,10,Small 10 - 49,50.1052521,8.6966508,Germany
QUERFORMAT Medienkonzept GmbH,QUERFORMAT Medienkonzept GmbH,Gelbehirschstr. 12,,60313,Frankfurt am Main,7311,73,Werbeagenturen,Business Services,Services,10,Small 10 - 49,50.1153293,8.6869585,Germany
Questax GmbH,Questax GmbH,Eschersheimer Landstr. 223,,60320,Frankfurt am Main,7379,73,Sonstige Dienstleistungen auf dem Computersektor,Business Services,Services,50,Small 10 - 49,50.1340972,8.6710798,Germany
QUIPU GmbH,QUIPU GmbH,Königsberger Str. 1,,60487,Frankfurt am Main,7371,73,Programmierungsdienste für Computer etc.,Business Services,Services,145,Medium 50 - 249,50.12694,8.63111,Germany
Quoniam Asset Management GmbH,Quoniam Asset Management GmbH,Westhafenplatz 1,,60327,Frankfurt am Main,7389,73,Sonstige gewerbliche Dienstleistungen,Business Services,Services,78,Medium 50 - 249,50.1013225,8.66437,Germany
R + L Rosenberg & Lenhart Deutsche Pelzhandelsgesellschaft mbH,R + L Rosenberg & Lenhart,Ludwig-Landmann-Str. 349,,60487,Frankfurt am Main,2371,23,Pelzwaren,"Apparel, Finished Prdcts from Fabrics & Similar Materials",Manufacturing,16,Small 10 - 49,50.12731,8.62231,Germany
R. L. Mihm,R. L. Mihm,Gebeschusstr. 50,,65929,Frankfurt am Main,8322,83,Soziale Einrichtungen f. Alleinstehende u. Familien,Social Services,Services,15,Small 10 - 49,50.1038361,8.539755,Germany
R. Ritter Gebäudereinigungs GmbH,R. Ritter Gebäudereinigungs,Ahornstr. 65,,65933,Frankfurt am Main,7349,73,"Sonstige Hausreinigungs- u. Instandhaltungsdienste, Gebäudereinigung",Business Services,Services,406,Large 250 +,50.0975,8.5981,Germany
RA Sauerwein & Partner,RA Sauerwein & Partner,Schweizer Str. 54A,,60594,Frankfurt am Main,8111,81,Juristische Dienstleistungen,Legal Services,Services,13,Small 10 - 49,50.1022337,8.6801416,Germany
rabbit GmbH,rabbit eMarketing GmbH,Kaiserstr. 65,,60329,Frankfurt am Main,7311,73,Werbeagenturen,Business Services,Services,86,Medium 50 - 249,50.10796,8.66774,Germany
Radeberger Gruppe KG,Radeberger Gruppe KG,Darmstädter Landstr. 185,,60598,Frankfurt am Main,2082,20,"Malzgetränke, Brauerei",Food and Kindred Products,Manufacturing,5500,Large 250 +,50.0942809,8.6913909,Germany
Radiologie Sachsenhausen GmbH,Radiologie Sachsenhausen GmbH,Schulstr. 31,,60594,Frankfurt am Main,8011,80,Arztpraxen (ohne Kliniken),Health Services,Services,25,Small 10 - 49,50.1067079,8.6835564,Germany
